{
  "artifact_type": "dashboard",
  "format": "html",
  "brief": "운영 지표를 빠르게 판단하는 대시보드",
  "canvas": { "w": 1440, "h": 900 },
  "scope": {
    "included": ["운영 현황 화면", "이상 지표 탐색"],
    "excluded": ["관리자 설정", "사용자 권한 편집"]
  },
  "content_priority": [
    "이상 지표와 심각도",
    "원인 확인에 필요한 추세",
    "후속 조치"
  ],
  "audience": "일일 운영 담당자",
  "audience_frequency": "daily",
  "desired_action": "이상 지표를 찾아 후속 조치한다",
  "source_mode": "continue_improve",
  "must_preserve": ["승인된 수치", "브랜드 색상"],
  "must_not_assume": ["누락된 수치", "사용자 승인"]
}
